{
  "$schema": "../schemas/control-catalog.schema.json",
  "catalog_id": "atal-eap-control-catalog",
  "title": "ATAL Enterprise Assurance Profile \u2014 Control Catalog",
  "version": "0.3.0",
  "release_date": "2026-03-18",
  "description": "Canonical machine-readable control catalog for the ATAL Enterprise Assurance Profile (EAP). Controls are organized into families and are the authoritative source for all assurance-level overlays, checklists, and assessment activities.",
  "upstream_standard": "ATAL Standard \u2014 https://github.com/Elytra-Security/atal-standard",
  "status": "draft",
  "controls": [
    {
      "id": "EAP-CTRL-001",
      "title": "Integrity-protected evidence chain",
      "family": "Evidence and Assurance",
      "statement": "Evidence objects (decision records, trails, SML, EIT, CAG snapshots, manifests) MUST be covered by an integrity mechanism that provides tamper evidence, append-only semantics, and deterministic verification steps.",
      "rationale": "Without a tamper-evident evidence chain, assertions about past system behavior cannot be trusted in audit or incident response settings.",
      "assurance_levels": [
        "EAP-L1",
        "EAP-L2",
        "EAP-L3"
      ],
      "normative_strength": "MUST",
      "control_type": "technical",
      "criticality": "critical",
      "test_methods": [
        "artifact_inspection",
        "hash_verification",
        "chain_head_verification"
      ],
      "evidence_requirements": [
        "Forensic bundle manifest with hashes for all included objects",
        "Chain head reference recorded separately from the bundle",
        "Tamper simulation test result (modify one artifact and verify failure)"
      ],
      "mapped_atal_references": [
        "Evidence integrity",
        "Forensic bundle verifiability"
      ],
      "mapped_repo_sources": [
        "normative/evidence-integrity.md#EAP-CRYPTO-1",
        "mappings/atal-eap-control-map.md"
      ],
      "related_risks": [
        "Evidence tampering",
        "Audit evidence repudiation",
        "Chain replay"
      ],
      "compensating_controls": [
        "EAP-CTRL-002",
        "EAP-CTRL-003"
      ],
      "automation_candidate": true
    },
    {
      "id": "EAP-CTRL-002",
      "title": "Key custody and rotation",
      "family": "Evidence and Assurance",
      "statement": "Signing keys MUST be managed by enterprise-grade key management (KMS/HSM). Rotation schedules MUST be documented. Compromise procedures MUST include key revocation, trust discontinuity signaling, and chain re-anchoring guidance.",
      "rationale": "Keys managed outside enterprise key stores are exposed to application-level compromise, negating evidence integrity guarantees.",
      "assurance_levels": [
        "EAP-L1",
        "EAP-L2",
        "EAP-L3"
      ],
      "normative_strength": "MUST",
      "control_type": "operational",
      "criticality": "high",
      "test_methods": [
        "documentation_review",
        "kms_configuration_inspection",
        "rotation_log_audit"
      ],
      "evidence_requirements": [
        "KMS/HSM configuration documentation",
        "Key rotation schedule",
        "Compromise response procedure document"
      ],
      "mapped_atal_references": [
        "Integrity requirements",
        "Audit readiness"
      ],
      "mapped_repo_sources": [
        "normative/evidence-integrity.md#EAP-CRYPTO-2",
        "mappings/atal-eap-control-map.md"
      ],
      "related_risks": [
        "Key compromise",
        "Evidence repudiation",
        "Audit trail invalidation"
      ],
      "compensating_controls": [],
      "automation_candidate": false
    },
    {
      "id": "EAP-CTRL-003",
      "title": "Verifier independence",
      "family": "Evidence and Assurance",
      "statement": "Evidence MUST be verifiable without proprietary vendor systems. A verification guide MUST document required inputs, verification steps, failure modes, and result interpretation.",
      "rationale": "Vendor-locked verification creates single points of failure in audit and incident response and prevents independent assurance.",
      "assurance_levels": [
        "EAP-L1",
        "EAP-L2",
        "EAP-L3"
      ],
      "normative_strength": "MUST",
      "control_type": "operational",
      "criticality": "high",
      "test_methods": [
        "documentation_review",
        "independent_verification_exercise"
      ],
      "evidence_requirements": [
        "Verification guide document",
        "Evidence of at least one successful independent verification exercise"
      ],
      "mapped_atal_references": [
        "Verifiable without proprietary systems",
        "Auditor portability"
      ],
      "mapped_repo_sources": [
        "normative/evidence-integrity.md#EAP-CRYPTO-3",
        "mappings/atal-eap-control-map.md"
      ],
      "related_risks": [
        "Auditor lock-in",
        "Verification failure under vendor unavailability"
      ],
      "compensating_controls": [],
      "automation_candidate": false
    },
    {
      "id": "EAP-CTRL-004",
      "title": "Minimum event fields for evidence objects",
      "family": "Governance",
      "statement": "Evidence objects MUST include event_time (wall clock), monotonic_time (node monotonic where available), sequence_number (per producer), and producer identity.",
      "rationale": "Without minimum temporal and identity fields, reconstructing causal ordering across distributed systems is unreliable and potentially unresolvable.",
      "assurance_levels": [
        "EAP-L1",
        "EAP-L2",
        "EAP-L3"
      ],
      "normative_strength": "MUST",
      "control_type": "technical",
      "criticality": "high",
      "test_methods": [
        "schema_validation",
        "sample_artifact_inspection"
      ],
      "evidence_requirements": [
        "Sample evidence objects demonstrating all required fields",
        "Schema or validation rule enforcing field presence"
      ],
      "mapped_atal_references": [
        "Reconstructability",
        "Timestamps"
      ],
      "mapped_repo_sources": [
        "normative/time-and-ordering.md#EAP-TIME-1",
        "mappings/atal-eap-control-map.md"
      ],
      "related_risks": [
        "Ordering ambiguity",
        "Causal reconstruction failure",
        "Audit gap"
      ],
      "compensating_controls": [
        "EAP-CTRL-005"
      ],
      "automation_candidate": true
    },
    {
      "id": "EAP-CTRL-005",
      "title": "Declared ordering model",
      "family": "Governance",
      "statement": "Deployments MUST declare an ordering model (centralized or hybrid). Reconciliation rules MUST be documented and auditable, covering tie-break rules, clock tolerance, and partition behavior.",
      "rationale": "Without a declared ordering model, distributed evidence trails cannot be authoritatively reconstructed, undermining causality claims in audit findings.",
      "assurance_levels": [
        "EAP-L2",
        "EAP-L3"
      ],
      "normative_strength": "MUST",
      "control_type": "operational",
      "criticality": "high",
      "test_methods": [
        "documentation_review",
        "reconstruction_drill"
      ],
      "evidence_requirements": [
        "Ordering model declaration document",
        "Reconciliation rules documented",
        "Evidence of reconstruction drill using declared model"
      ],
      "mapped_atal_references": [
        "Decision trail reconstruction"
      ],
      "mapped_repo_sources": [
        "normative/time-and-ordering.md#EAP-TIME-2",
        "examples/ordering-models/"
      ],
      "related_risks": [
        "Distributed ordering failure",
        "Partition-induced audit gaps"
      ],
      "compensating_controls": [],
      "automation_candidate": false
    },
    {
      "id": "EAP-CTRL-006",
      "title": "Replay and duplication detection",
      "family": "Security",
      "statement": "Duplicate record_id or replayed evidence objects MUST be detectable. The system MUST define how replays are flagged and how investigations proceed.",
      "rationale": "Without replay detection, an adversary can re-submit captured evidence objects to corrupt causal chain analysis or hide activity.",
      "assurance_levels": [
        "EAP-L2",
        "EAP-L3"
      ],
      "normative_strength": "MUST",
      "control_type": "technical",
      "criticality": "high",
      "test_methods": [
        "replay_simulation_test",
        "documentation_review"
      ],
      "evidence_requirements": [
        "Replay detection mechanism documentation",
        "Test result showing replay flagged in controlled test",
        "Investigation runbook for replay events"
      ],
      "mapped_atal_references": [
        "Reconstructability"
      ],
      "mapped_repo_sources": [
        "normative/time-and-ordering.md#EAP-TIME-3"
      ],
      "related_risks": [
        "Evidence replay attack",
        "Audit corruption"
      ],
      "compensating_controls": [
        "EAP-CTRL-001"
      ],
      "automation_candidate": true
    },
    {
      "id": "EAP-CTRL-007",
      "title": "Controlled invocation surface",
      "family": "Enforcement",
      "statement": "Tool, API, memory, and routing endpoints MUST be reachable only through the ATAL enforcement layer. Any direct access path MUST be blocked using network and identity controls, not only application logic.",
      "rationale": "Application-only controls are bypassable by privileged users, compromised hosts, or misconfigured network paths. Non-bypassability requires infrastructure-level enforcement.",
      "assurance_levels": [
        "EAP-L1",
        "EAP-L2",
        "EAP-L3"
      ],
      "normative_strength": "MUST",
      "control_type": "technical",
      "criticality": "critical",
      "test_methods": [
        "bypass_attempt_test",
        "network_policy_inspection",
        "identity_policy_inspection"
      ],